{
  "$comment": "台股市值前 60 大 — 由 twse_pipeline.universe_rank 每交易日重排，勿手改。前端顯示前 displayCount 檔（snapshot 另依當日市值重排）；其餘供回測選股池。sharesOutstandingM = 已發行普通股數（百萬股）。",
  "rankedAt": "2026-10-14",
  "displayCount": 20,
  "constituents": [
    {
      "code": "2330",
      "name": "台積電",
      "sharesOutstandingM": 25932.37
    },
    {
      "code": "2454",
      "name": "聯發科",
      "sharesOutstandingM": 1604.953
    },
    {
      "code": "2308",
      "name": "台達電",
      "sharesOutstandingM": 2597.543
    },
    {
      "code": "2317",
      "name": "鴻海",
      "sharesOutstandingM": 14075.746
    },
    {
      "code": "3711",
      "name": "日月光投控",
      "sharesOutstandingM": 4470.572
    },
    {
      "code": "1303",
      "name": "南亞",
      "sharesOutstandingM": 7930.822
    },
    {
      "code": "2881",
      "name": "富邦金",
      "sharesOutstandingM": 14007.365
    },
    {
      "code": "2383",
      "name": "台光電",
      "sharesOutstandingM": 358.321
    },
    {
      "code": "3037",
      "name": "欣興",
      "sharesOutstandingM": 1641.292
    },
    {
      "code": "2303",
      "name": "聯電",
      "sharesOutstandingM": 12570.094
    },
    {
      "code": "2408",
      "name": "南亞科",
      "sharesOutstandingM": 3450.206
    },
    {
      "code": "2882",
      "name": "國泰金",
      "sharesOutstandingM": 14669.21
    },
    {
      "code": "2891",
      "name": "中信金",
      "sharesOutstandingM": 19675.933
    },
    {
      "code": "2382",
      "name": "廣達",
      "sharesOutstandingM": 4107.627
    },
    {
      "code": "3017",
      "name": "奇鋐",
      "sharesOutstandingM": 392.67
    },
    {
      "code": "2327",
      "name": "國巨",
      "sharesOutstandingM": 2063.128
    },
    {
      "code": "6669",
      "name": "緯穎",
      "sharesOutstandingM": 560.2
    },
    {
      "code": "2412",
      "name": "中華電",
      "sharesOutstandingM": 7757.447
    },
    {
      "code": "2345",
      "name": "智邦",
      "sharesOutstandingM": 561.118
    },
    {
      "code": "6505",
      "name": "台塑化",
      "sharesOutstandingM": 9525.96
    },
    {
      "code": "7769",
      "name": "鴻勁",
      "sharesOutstandingM": 179.93
    },
    {
      "code": "3443",
      "name": "創意",
      "sharesOutstandingM": 134.012
    },
    {
      "code": "2887",
      "name": "台新新光金",
      "sharesOutstandingM": 25115.062
    },
    {
      "code": "3653",
      "name": "健策",
      "sharesOutstandingM": 147.204
    },
    {
      "code": "2885",
      "name": "元大金",
      "sharesOutstandingM": 13864.396
    },
    {
      "code": "2059",
      "name": "川湖",
      "sharesOutstandingM": 95.297
    },
    {
      "code": "3008",
      "name": "大立光",
      "sharesOutstandingM": 130.798
    },
    {
      "code": "2360",
      "name": "致茂",
      "sharesOutstandingM": 425.246
    },
    {
      "code": "8046",
      "name": "南電",
      "sharesOutstandingM": 646.165
    },
    {
      "code": "2884",
      "name": "玉山金",
      "sharesOutstandingM": 17723.51
    },
    {
      "code": "2886",
      "name": "兆豐金",
      "sharesOutstandingM": 14833.378
    },
    {
      "code": "2344",
      "name": "華邦電",
      "sharesOutstandingM": 4500.0
    },
    {
      "code": "2357",
      "name": "華碩",
      "sharesOutstandingM": 742.76
    },
    {
      "code": "2880",
      "name": "華南金",
      "sharesOutstandingM": 14056.135
    },
    {
      "code": "2890",
      "name": "永豐金",
      "sharesOutstandingM": 14782.169
    },
    {
      "code": "2883",
      "name": "凱基金",
      "sharesOutstandingM": 16974.612
    },
    {
      "code": "3231",
      "name": "緯創",
      "sharesOutstandingM": 3429.842
    },
    {
      "code": "2301",
      "name": "光寶科",
      "sharesOutstandingM": 2316.108
    },
    {
      "code": "4958",
      "name": "臻鼎-KY",
      "sharesOutstandingM": 1133.397
    },
    {
      "code": "2395",
      "name": "研華",
      "sharesOutstandingM": 869.046
    },
    {
      "code": "2368",
      "name": "金像電",
      "sharesOutstandingM": 530.595
    },
    {
      "code": "2892",
      "name": "第一金",
      "sharesOutstandingM": 14379.469
    },
    {
      "code": "2603",
      "name": "長榮",
      "sharesOutstandingM": 2165.043
    },
    {
      "code": "3189",
      "name": "景碩",
      "sharesOutstandingM": 526.91
    },
    {
      "code": "1301",
      "name": "台塑",
      "sharesOutstandingM": 6365.741
    },
    {
      "code": "6446",
      "name": "藥華藥",
      "sharesOutstandingM": 422.435
    },
    {
      "code": "3045",
      "name": "台灣大",
      "sharesOutstandingM": 3723.431
    },
    {
      "code": "1326",
      "name": "台化",
      "sharesOutstandingM": 5861.186
    },
    {
      "code": "3665",
      "name": "貿聯-KY",
      "sharesOutstandingM": 199.578
    },
    {
      "code": "1216",
      "name": "統一",
      "sharesOutstandingM": 5682.015
    },
    {
      "code": "5880",
      "name": "合庫金",
      "sharesOutstandingM": 16072.96
    },
    {
      "code": "3481",
      "name": "群創",
      "sharesOutstandingM": 7989.197
    },
    {
      "code": "2449",
      "name": "京元電子",
      "sharesOutstandingM": 1283.882
    },
    {
      "code": "2379",
      "name": "瑞昱",
      "sharesOutstandingM": 515.513
    },
    {
      "code": "4904",
      "name": "遠傳",
      "sharesOutstandingM": 3607.705
    },
    {
      "code": "3661",
      "name": "世芯-KY",
      "sharesOutstandingM": 86.305
    },
    {
      "code": "2801",
      "name": "彰銀",
      "sharesOutstandingM": 12060.197
    },
    {
      "code": "2615",
      "name": "萬海",
      "sharesOutstandingM": 2806.146
    },
    {
      "code": "3034",
      "name": "聯詠",
      "sharesOutstandingM": 608.511
    },
    {
      "code": "6770",
      "name": "力積電",
      "sharesOutstandingM": 4712.081
    }
  ]
}
